id,date,treeId,species,address,activitiesDone,durationMinutes,scrapedAt
83531,2026-03-24,14051588,American elm,484 East Houston Street,Weeded; Managed Soil; Mulched; Cleared Litter/Waste,20,2026-03-27
83532,2026-03-24,15218033,Unknown,484 E Houston St,Cleared Litter/Waste,10,2026-03-27
83533,2026-03-24,2122382,thornless honeylocust,484 East Houston Street,Cleared Litter/Waste,10,2026-03-27
83524,2026-03-24,14051588,American elm,484 East Houston Street,Weeded; Managed Soil; Mulched; Cleared Litter/Waste,20,2026-03-27
83525,2026-03-24,14051576,pin oak,500 East Houston Street,Weeded; Managed Soil; Cleared Litter/Waste,20,2026-03-27
